ccbaKdcd,ccbaAsno,ccbaCtcd,ccbaMnm1,ccbaLcad,ccceName,content,imageUrl
11,00650000,11,청자 기린형뚜껑 향로,"서울특별시 성북구 성북로 102-11 (성북동, 간송미술관)",고려시대(12세기),"고려청자의 전성기인 12세기경에 만들어진 청자향로로 높이는 20㎝이다. 향을 피우는 부분인 몸체와 상상속의 동물인 기린이 꿇어 앉아있는 모습을 한 뚜껑으로 구성되어 있다. 
 몸체는 윗부분이 넓게 바깥쪽으로 벌어져 있고 짐승모양을 한 3개의 다리가 떠받치고 있다. 몸통에는 구름무늬가 장식되었고 윗면 가장자리에도 세 곳에 구름무늬가 배치되었으며, 그 위에 뚜껑을 덮도록 하였다. 뚜껑 한복판에는 뒤를 돌아보고 있는 기린이 조각되어 있고, 기린이 앉아있는 자리의 옆면에는 번개무늬가 돌아가며 음각되었다. 기린의 머리에는 뿔이 돋아있으나 부러져 있는 상태이고, 목뒤의 부분은 곱슬곱슬하게 표현하였다. 눈은 검은색 안료를 사용해 점을 찍었다. 구조상 향의 연기는 벌려진 기린의 입을 통하여 뿜어 나오도록 만들어졌다.
 비취색 특유의 은은한 광택이 향로 전체를 품위있게 감싸고 있다.12세기에 비취색의 청자가 절정에 달하였을 때, 이와 같이 상서로운 동물이나 식물을 본뜬 상형청자가 많이 만들어졌다.",http://www.cha.go.kr/unisearch/images/national_treasure/1611465.jpg
11,00660000,11,청자 상감연지원앙문 정병,"서울특별시 성북구 성북로 102-11 (성북동, 간송미술관)",고려시대(12세기),"고려시대의 청자 정병으로 높이 37.0㎝, 밑지름 8.9㎝의 크기이다. 원래 정병은 불교에서 모든 악을 씻어 버리는 의식에서 사용하던 용기의 하나로 중국을 거쳐 전해진 서방(西方) 양식이었으나, 고려에 와서 가장 세련되게 나타나게 되었다.
 이 작품은 이러한 유물 중에서도 뛰어난 걸작으로 청아한 담록색 계통의 비취색 유약에 백토(白土) 상감만으로 새겨진 버드나무와 갈대, 연꽃, 원앙새 1쌍을 회화적으로 배치해 놓고 있다. 병 목에는 앞뒤 양면에 모란꽃을 하나씩 상감했다. 물을 따르는 부리는 8각으로 기품있게 만들어 병 목 위에 수직으로 세워 놓았다. 물을 넣는 아가리는 둥근 어깨 한쪽에 아담하게 붙어 있는데, 원래 뚜껑이 있었으나 없어진 상태이다.  
 대체로 이른 시기의 상감청자는 유약이나 바탕흙이 매우 정선되어 있고, 청아한 비취색 유약이 세련미를 보여주는 것이 특색인데, 이러한 바탕 위에 상감무늬가 곁들여졌던 만큼 한층 더 장식 효과를 높일 수 있었다. 이 정병 또한 이러한 이른 시기의 상감청자로 매우 정제되고 세련된 양식을 보여주고 있다.",http://www.cha.go.kr/unisearch/images/national_treasure/1611466.jpg
11,00670000,36,구례 화엄사 각황전,"전남 구례군 마산면 화엄사로 539, 화엄사 (황전리) / (지번)전남 구례군 마산면 황전리 12 화엄사",조선 숙종 23년(1697),"화엄사는 지리산 남쪽 기슭에 있는 절로 통일신라시대에 지었다고 전한다. 조선시대에는 선종대본산(禪宗大本山) 큰절이었는데, 임진왜란 때 완전히 불타버린 것을 인조 때 다시 지어 오늘에 이르고 있다.
 원래 각황전터에는 3층의 장육전이 있었고 사방의 벽에 화엄경이 새겨져 있었다고 하나, 임진왜란 때 파괴되어 만여점이 넘는 조각들만 절에서 보관하고 있다. 조선 숙종 28년(1702)에 장륙전 건물을 다시 지었으며, ‘각황전’이란 이름은 임금(숙종)이 지어 현판을 내린 것이라고 한다.
 이 건물은 신라시대에 쌓은 것으로 보이는 돌기단 위에 앞면 7칸·옆면 5칸 규모로 지은 2층 집이다. 지붕은 옆면에서 볼 때 여덟 팔(八)자 모양인 팔작지붕으로, 지붕 처마를 받치기 위해 장식하여 짜은 구조가 기둥 위뿐만 아니라 기둥 사이에도 있는 다포 양식이라 매우 화려한 느낌을 준다. 건물 안쪽은 위·아래층이 트인 통층으로 3여래불상과 4보살상을 모시고 있다. 천장은 우물 정(井)자 모양인데, 벽쪽 사방으로 돌아가면서 경사지게 처리하였다.
 화엄사 각황전은 건물이 매우 웅장하며 건축기법도 뛰어나 우수한 건축 문화유산으로 평가받고 있다.",http://www.cha.go.kr/unisearch/images/national_treasure/1612538.jpg
11,00680000,11,청자 상감운학문 매병,"서울 성북구 성북로 102-11, 간송미술관 (성북동,간송미술관)",고려시대(12세기 후반),"고려 매병(梅甁)은 중국 송(宋)나라 매병에서 유래된 것이지만, 12세기경에 이르러서는 고려만의 풍만하면서도 유연한 선의 아름다움이 나타난다. 이러한 고려 매병의 양식은 이 작품에서 세련미의 극치를 보여주고 있다.
 높이 42.1㎝, 입지름 6.2㎝, 밑지름 17㎝의 크기의 매병의 구연부는 작고 낮으며 밖으로 살짝 벌어져 있다. 어깨는 넓고 당당한 모습을 보여준다. 구연부의 아랫부분에는 꽃무늬를 둘렀으며 굽 위로는 연꽃무늬를 둘렀다. 몸통 전면에는 구름과 학을 새겨 넣었는데, 흑백상감한 원 안에는 하늘을 향해 날아가는 학과 구름무늬를, 원 밖에는 아래쪽을 향해 내려가는 학과 구름무늬를 새겼다. 
 학의 진행방향을 다르게 표현한 것은 도자기 표면이라는 일정한 제약을 넘어 사방으로 공간을 확산시켜 짜여진 구획으로부터의 자유로움을 추구한 듯하다. 이같은 표현상의 변화 추구와 함께 문양처리의 능숙함에서 고려 도자기의 우수함과 고려인의 창의력을 엿볼 수 있다.",http://www.cha.go.kr/unisearch/images/national_treasure/1611467.jpg
11,00690000,21,심지백 개국원종공신녹권,"부산광역시 서구 구덕로 (부민동2가, 동아대학교부민캠퍼스) 동아대학교박물관",조선 태조 6년(1397),"조선 태조 6년(1397) 10월에 공신도감(功臣都監)에서 왕의 명령을 받아 심지백(沈之伯)에게 내린 문서로, 공신임을 입증하는 내용을 담고 있다. 크기는 가로 140㎝, 세로 30.5㎝이며, 원래는 함경남도 단천군 파도면 심씨 집안에서 물려 내려오던 것이다.
 개국원종공신(開國原從功臣) 제도는 조선시대에 개국공신을 늘리려는 의도에서 만들어진 일종의 새로운 포상제도로, 1392년부터 1397년까지 여러 차례에 걸쳐 1,400여 명에게 봉해졌다. 심지백이 녹권을 받을 때에도 74명이 함께 받았는데, 이때 그들에게 내린 포상으로는 각기 밭 15결(結)을 내렸고, 각 공신의 부모와 처에게는 땅을 주고 벼슬을 내렸으며, 자손에게는 벼슬을 주었다. 이러한 사실은 실록에도 빠져있어 알려지지 않았으나 이 문서에 의하여 비로소 알려지게 되었다.
 이 문서는 조선 전기의 문서로 이두문(吏讀文)이 많이 사용되어 그 문체와 내용이 귀중한 역사적 자료가 되며, 목활자를 이용하여 찍어냈다는 점에서 더욱 중요성이 엿보인다. 또한 조선 전기의 목활자 인쇄물로서 상태가 완전하고 남한에 전해지고 있는 것으로는 이 문서가 으뜸으로 손꼽혀지는데, 두루마리로 되어있는 점에서도 조선 전기의 특징을 엿볼 수 있다. 글자 크기가 일정하지 않고 글자배열이 고르지 않는 등 인쇄가 정교하지는 않으나, 현존하는 목활자 인쇄물이라는 점에서 한국 활자 역사상 매우 귀중한 인쇄자료가 된다.",http://www.cha.go.kr/unisearch/images/national_treasure/1611957.jpg
11,00700000,11,훈민정음,"서울특별시 성북구 성북로 102-11 (성북동, 간송미술관)",조선 세종 28년(1446),"이 책은 새로 창제된 훈민정음을 왕의 명령으로 정인지 등 집현전 학사들이 중심이 되어 세종 28년(1446)에 만든 한문해설서이다. 책이름을 글자이름인 훈민정음과 똑같이 ‘훈민정음’이라고도 하고, 해례가 붙어 있어서 ‘훈민정음 해례본’또는 ‘훈민정음 원본’이라고도 한다. 전권 33장 1책의 목판본이나, 앞 2장은 1940년경에 복원된 부분이다.
 구성을 보면 총 33장 3부로 나누어, 제1부는 훈민정음의 본문을 4장 7면으로 하여 면마다 7행 11자씩, 제2부는 훈민정음해례를 26장 51면 3행으로 하여 면마다 8행 13자씩, 제3부는 정인지의 서문을 3장 6면에 1자 내려싣고, 그 끝에 ‘정통 11년’(1446)이라 명시하고 있다.
『세종실록』에 의하면 훈민정음은 세종 25년(1443)에 왕이 직접 만들었으며, 세종 28년(1446)에 반포한 것으로 되어있는데, 이 책에서 서문과 함께 정인지가 근작(謹作)하였다는 해례를 비로소 알게 되었다. 또한 한글의 제작원리도 확연하게 드러났다.",http://www.cha.go.kr/unisearch/images/national_treasure/1611468.jpg
11,00710000,11,"동국정운 권1, 6","서울특별시 성북구 성북로 102-11 (성북동, 간송미술관)",조선 세종 30년(1448),"조선 세종 때 신숙주, 최항, 박팽년 등이 왕의 명으로 편찬하여 세종 30년(1448)에 간행한 우리나라 최초의 표준음에 관한 책으로, 6권 6책의 활자본이다.
중국의 운(韻)에 관한 책인 『홍무정운』에 대비되는 것으로, ‘동국정운’이란 우리나라의 바른 음이라는 뜻이다. 당시 혼란스럽던 우리나라의 한자음을 바로잡아 통일된 표준음을 정하려는 목적으로  편찬, 간행되었다.
 이 책은 세종 29년(1447) 9월에 완성되자 간행하라는 임금의 명이 있었고, 이듬해인 세종 30년(1448) 11월에 성균관, 사부학당 등에 보급되어, 이 책이 간행되고 보급되었던 시기를 알 수 있다. 
 현재 이 책은 전 6권 가운데 1권과 6권만이 남아있다. 내용을 보면 본문의 큰 글자는 나무활자이고, 작은 글자와 서문의 큰 글자는 갑인자이다. 글자체는 큰 글자가 진양대군의 글씨이다.
 우리나라에서 최초로 한자음을 우리의 음으로 표기하였다는 점에서 큰 의의를 가지고 있으며, 국어연구자료로서의 중요성도『훈민정음』과 쌍벽을 이룰 정도로 높이 평가되고 있다. 또한 한자음의 음운체계 연구에 있어서뿐만 아니라, 훈민정음의 글자를 만든 배경이나 음운체계 연구에 있어서 기본자료가 된다.",http://www.cha.go.kr/unisearch/images/national_treasure/1611476.jpg
11,00720000,11,금동계미명삼존불입상,"서울특별시 성북구 성북로 102-11 (성북동, 간송미술관)",삼국시대,"커다란 하나의 광배(光背)를 배경으로 중앙에 본존불과 양 옆에 협시보살을 배치하고 있는 삼존불(三尊佛)이다.
중앙의 본존불은 상투 모양의 머리(육계)가 불상 전체 크기에 비해 크고 높게 표현되었다. 미소를 띤 갸름한 얼굴은 앞으로 약간 숙이고 있으며, 어깨와 가슴은 약간 좁은 듯 하지만 둥글고 강인하게 처리되었다. 양 어깨를 감싸고 있는 옷에는 정면으로 V자형 옷주름이 있으며, 좌우로는 새의 깃같은 옷자락이 뻗치고 있다. 오른손은 손바닥을 정면으로 하고 손끝이 위로 향하고 있으며, 왼손은 손바닥을 정면으로 하고 손끝은 아래를 향하고 있는데 손가락 2개를 구부리고 있는 모습이 특징이다.
 양 옆에 배치한 협시보살은 광배의 끝에 매달리듯 표현하였으며, 세가닥으로 올라간 보관(寶冠)을 쓰고 있다. 신체 표현은 본존불과 비슷하지만, 앞면에서 X자로 교차하고 있는 옷주름과 손모양이 다르다. 불꽃이 타오르는 모양을 가는 선으로 장식한 광배(光背)는 끝이 뾰족한 배(舟) 모양으로, 본존 주위에는 머리광배와 몸광배를 도드라지게 새기고 그 안에 연꽃무늬, 덩쿨무늬, 인동초무늬를 새겼다. 불상이 서 있는 대좌(臺座)는 바닥이 밖으로 퍼진 원통형이며 연꽃이 새겨져 있다.
 금동신묘명삼존불(국보)의 양식과 비슷한 점이 많으며, 중국 남북조시대의 불상 양식을 따르고 있는 이 불상은 광배 뒷면에 새겨진 글에 의해 백제 위덕왕 10년(563)에 만든 것으로 추정된다.",http://www.cha.go.kr/unisearch/images/national_treasure/1611478.jpg
11,00730000,11,금동삼존불감,"서울특별시 성북구 성북로 102-11 (성북동, 간송미술관)",고려시대 초기,"불상을 모시기 위해 나무나 돌, 쇠 등을 깎아 일반적인 건축물보다 작은 규모로 만든 것을 불감(佛龕)이라고 한다. 불감은 그 안에 모신 불상의 양식뿐만 아니라, 당시의 건축 양식을 함께 살필 수 있는 중요한 자료가 된다. 
 이 작품은 높이 18㎝의 작은 불감으로, 청동으로 불감과 불상을 만들고 그 위에 금칠을 하였다. 불감 내부를 살펴보면 난간을 두른 사각형의 기단 위에 본존불과 양 옆에 보살상이 있으며, 그 위에 기둥과 지붕으로 된 뚜껑이 덮혀 있다. 법당 모양의 뚜껑에는 앞면과 양쪽에 커다란 창문이 있어서 안에 모셔진 불상을 잘 볼 수 있도록 하였다.
 본존불은 얼굴이 추상적이고, 양 어깨를 감싸고 있는 옷은 주름을 간략한 선으로 표현했다. 몸 뒤편에 있는 광배(光背)는 머리광배와 몸광배로 나누어져 있으며, 불꽃무늬로 가장자리를 장식하고 있다. 본존불 양 옆의 보살상도 구슬로 장식된 관(冠)을 쓰고 있다는 점을 제외하면 형식이나 표현 수법이 본존불과 유사하다.
 불감은 지금도 금색이 찬란하고 지붕에 녹청색이 남아 있는 등 전체적인 보존 상태가 양호하다. 본존불의 긴 허리, 불규칙하게 나타나는 옷주름, 그리고 보살이 쓰고 있는 구슬로 장식한 관(冠) 등 여러 양식으로 보아 만든 시기는 중국 북방 계통의 영향을 받은 11∼12세기 경으로 추정된다. 이 작품은 고려시대 또는 그 이전의 목조건축 양식과 조각수법을 보여주는 귀중한 예라는 점에서 가치가 크다고 할 수 있다.",http://www.cha.go.kr/unisearch/images/national_treasure/1611479.jpg
11,00740000,11,청자 오리모양 연적,"서울특별시 성북구 성북로 102-11 (성북동, 간송미술관)",고려시대(12세기),"오리 모양으로 만든 고려시대의 청자 연적으로 높이 8㎝, 너비 12.5㎝의 크기이다.
 물위에 뜬 오리가 연꽃줄기를 물고 있으며 연잎과 봉오리는 오리의 등에 자연스럽게 붙어있다. 오리의 등의 연잎으로 장식된 부분에는 구멍이 있어서 물을 넣도록 되어있고, 연꽃 봉오리 모양의 작은 마개를 꽂아서 덮고 있다. 물을 따르는 부리는 오리 주둥이 오른편에 붙어 있는데, 이 부리가 연줄기에 달린 봉오리 끝으로 통했으리라 짐작되지만, 지금은 그 부분이 부서져 있어 원형을 확실히 알 수 없다. 
 이 연적은 오리의 깃털까지도 매우 사실적으로 표현하는 정교한 기법을 보여주고 있으며, 알맞은 크기와 세련된 조각기법, 그리고 비색(翡色)의 은은함을 통해 고려 귀족 사회의 일면을 엿볼 수 있는 훌륭한 작품이다.",http://www.cha.go.kr/unisearch/images/national_treasure/1611481.jpg
11,00750000,38,표충사 청동 은입사 향완,경남 밀양시 단장면 구천리 산31-2번지 표충사,고려 명종 7년(1177),"향완이란 절에서 의식을 행하거나 불단에 올려놓고 향을 피우는데 사용된 공양구이다. 특히 이처럼 완형(盌形)의 몸체에 나팔처럼 벌어진 자리와 원반형 받침을 지닌 형태를 향완이라 불렀다. 경상남도 밀양 표충사에 있는 청동 향완은 높이 27.5㎝, 입지름 26.1㎝의 크기이다. 향완에 무늬를 새기고 그 틈에 은실을 박아서 장식한 은입사(銀入絲) 기술이 매우 정교하면서도 세련된 작품이다.
 향완의 형태는 주둥이 부분에 넓은 전이 달린 몸체와 바깥으로 벌어진 나팔모양의 받침을 갖춘 모습이, 고려시대의 전형적인 양식이다. 전과 몸체가 닿는 부분을 둥글게 처리하고 받침 둘레의 가장자리에 얕은 턱을 만들어 안정감을 주었다. 높이나 너비의 비율도 거의 1：1을 이룸으로써 균형잡힌 비례감각을 보여주고 있다. 넓은 전 윗면에는 일정한 간격으로 배치된 6개의 원 안에 ‘범자(梵字)’를 은입사하였으며, 그 사이사이에 구름무늬를 장식하였다. 몸체에도 역시 굵고 가는 여러 선으로 원 안에 굵게 은입사한 ‘범자(梵字)'가 4곳에 배치되어 있다. 받침에는 구름과 용무늬를 장식하였는데, 굵고 가는 선을 이용하여 능숙하게 표현된 용의 모습에서 고려시대 뛰어난 은입사기법을 보여주고 있다.
 넓은 전의 안쪽 면에는 57자의 은입사로 된 명문을 새겼는데, 내용으로 미루어 고려 명종 7년(1177)에 제작된 것임을 알 수 있다. 이는 국내에 남아있는 향완으로는 가장 오래된 것으로, 고려 향완 연구에 귀중한 편년자료이다. 뿐만 아니라 원래 이 향완이 있었던 곳이 현재의 표충사가 아닌 창녕 용흥사였음을 알 수 있지만 언제, 어떻게 해서 표충사에 전래되었는지는 분명치 않다.",http://www.cha.go.kr/unisearch/images/national_treasure/1613066.jpg
11,00760000,34,이순신 난중일기 및 서간첩 임진장초,"충청남도 아산시 현충사길 48 (염치읍, 현충사)",조선 선조 25∼31년,"이 책은 임진왜란(1592∼1598) 때에 이순신(1545∼1598)이 친필로 작성한 일기로 연도별로 7권이다.
 이순신은 28살되던 해에 무인 선발시험인 훈련원별과에 응시했으나, 불행하게도 달리던 말이 거꾸러지는 바람에 실격하였고, 4년 뒤 무과에 급제하여 권지훈련원봉사로 처음 벼슬을 시작했다. 사대부가의 전통인 충효와 문학에 있어서 뛰어났을 뿐 아니라 시(詩)를 짓는데도 특출하였다. 전라좌도 수군절도사를 지내던 때 곧 왜적의 침입이 있을 것에 대비하여 여수를 중심으로 배를 만들고 군비를 늘리는 등 일본의 침략에 대처하였다.
 1592년 임진왜란이 터지자 옥포대첩, 거북선이 최초로 모습을 드러낸 사천해전, 당항포해전, 한산대첩 등 곳곳에서 전승을 거두었고, 정유재란 때에는 명량대첩 등에서 승리를 거두었다. 그가 죽은 후 1604년 선무공신 1등에 올랐고, 영의정에 추증되었으며, 충무(忠武)라는 시호가 내려졌다. 지극한 충성심과 숭고한 인격, 위대한 통솔력으로 위기에 처한 나라를 구하였을 뿐만 아니라 민족사에 독보적으로 길이 남을 인물이다.
 일기의 구성을 보면 제1권은『임진일기』로 선조 25년(1592) 5월 1일부터 선조 26년(1593) 3월까지 27매, 제2권은『계사일기』로 선조 26년(1593) 5월 1일부터 9월 15일까지 30매, 제3권은『갑오일기』로 선조 27년(1594) 1월 1일부터 7월 28일까지 52매, 제4권은『병신일기』로 선조 29년(1596) 1월 1일부터 10월 11일까지 41매, 제5권은『정유일기』로 선조 30년(1597) 4월 1일부터 10월 8일까지 27매, 제6권은『정유일기속』으로 선조 30년(1597) 8월 4일부터 선조 31년(1598) 1월 4일까지 20매이나 약간의 중복된 부분이 있다. 제7권은『무술일기』로 선조 31년(1592) 9월 15일부터 10월 7일까지 8매로 구성되어 있다.
 7년의 난 동안 왜적과 싸우면서 틈틈이 계속하여 쓴 것으로, 후손들이 대대로 보존하여 390여년을 간직해 온 것이다. 이것은『충무공전서』에 수록된 난중일기의 초본으로, 내용중에는 수군통제에 관한 군사비책과 전황을 보고한 장계의 초안 등이 상세히 수록되어 있어 당시 군사제도에 대해 연구가치가 매우 높은 자료로 평가된다.",http://www.cha.go.kr/unisearch/images/national_treasure/1612255.jpg
11,00770000,37,의성 탑리리 오층석탑,경북 의성군 금성면 오층석탑길 5-3 (탑리),통일신라시대,"탑리리 마을에 세워져 있는 통일신라시대의 5층 석탑이다. 낮은 1단의 기단(基壇) 위에 5층의 탑신(塔身)을 세운 모습으로, 돌을 벽돌 모양으로 다듬어 쌓아올린 전탑(塼塔)양식과 목조건축의 수법을 동시에 보여주는 특이한 구조를 가지고 있다.
 기단은 여러 개의 돌로 바닥을 깐 뒤, 목조건축을 본떠 가운데기둥과 모서리기둥 모두를 각각 다른 돌로 구성하였다. 탑신은 1층이 높으며 2층부터는 높이가 급격히 줄어드는 모습을 보이는데, 1층 몸돌에는 불상을 모시는 방인 감실(龕室)을 설치하였다. 지붕돌은 전탑에서 보이는 모습처럼 밑면 뿐만 아니라 윗면까지도 층을 이루고 있는데 윗면이 6단, 아랫면이 5단이다. 지붕돌은 네 귀퉁이가 살짝 들려있어 목조건축의 지붕 끝을 떠올리게 한다.
 각 부분에서 목조건축의 양식을 응용하는 한편, 곳곳에서 전탑의 조성기법을 보여주는 작품이다. 이러한 독특한 특징으로 인해 경주 분황사 모전석탑(국보)과 함께 통일신라 전기의 석탑양식을 연구하는데 귀중한 자료가 되고 있다.",http://www.cha.go.kr/unisearch/images/national_treasure/1612805.jpg
11,00780000,11,금동미륵보살반가사유상(1962-1),"서울특별시 용산구 서빙고로 137 (용산동6가, 국립중앙박물관)",삼국시대,"의자 위에 앉아 오른발을 왼쪽다리 위에 올려 놓고, 오른쪽 팔꿈치를 무릎 위에 올린 채 손가락을 뺨에 댄 모습의 보살상으로 높이는 80㎝이다. 1912년에 일본인이 입수하여 조선총독부에 기증했던 것을 1916년 총독부박물관으로 옮겨졌고, 현재는 국립중앙박물관에서 보관하고 있다. 
 머리에는 화려한 관(冠)을 쓰고 있으며, 여기에서 나온 2가닥의 장식은 좌우로 어깨까지 늘어져 있다. 네모꼴에 가까운 얼굴은 풍만한 느낌을 주며, 광대뼈를 나오게 하고 입가를 들어가게 하여 미소 띤 얼굴을 만들었다. 
 상체는 당당하면서도 곧고 늘씬한 모습이며, 하체에서는 우아한 곡선미를 느낄 수 있다. 늘씬한 팔이나 체구에 비해서 손이나 발은 상대적으로 큼직한 편이다. 전체적으로 탄력이 있고 매끄러우며 부드럽고 율동적이어서 보살상의 우아한 모습을 한층 더 돋보이게 한다. 목 뒤로 돌아 양 어깨를 감싼 천의(天衣)는 새의 깃털처럼 치켜 올라갔다가 다시 가슴쪽으로 흘려내려 왼쪽 다리에서 교차한 다음, 양 무릎을 지나 두 팔을 감아 내렸다. 하체에 입은 치마는 다소 두툼해 보이는데 U자형 주름이 능숙하게 새겨져 있다.
 왼발을 올려 놓은 타원형의 대좌(臺座)에는 연꽃 무늬가 새겨져 있으며, 머리 뒷부분에 흔적만 있을 뿐 광배(光背)는 없어진 상태이다.
 1963년 방사선 투과법으로 촬영한 결과 내부의 결함이나 고친 흔적이 없으며, 재질이나 만든 기법이 매우 특이함이 밝혀졌다. 전체적으로 균형잡힌 자세, 아름다운 옷주름, 명상에 잠긴 듯한 오묘한 얼굴 등으로 보아 한국적 보살상을 성공적으로 완성시킨 6세기 중엽이나 그 직후의 작품으로 생각된다.",http://www.cha.go.kr/unisearch/images/national_treasure/1611483.jpg
